{"family":"invariants","generator_version":"m0-inventory-generator-v1","metadata":{"invariant_count":13,"source_schema_version":"m0-invariant-source-v1"},"oracle_commit":"c0adcf1f8ea7f69cad28b92e27c9a4509dfdac23","rows":[{"cadence":"replay","comparison":"exact","id":"invariant.controller.event-hash-chain","kind":"invariant","owner_milestone":"m10","scope":"controller","source_path":"macro_sim/controllers/events.py","source_symbol":"EventStream.verify","status":"active"},{"cadence":"transaction","comparison":"exact","id":"invariant.controller.world-policy-fingerprint","kind":"invariant","owner_milestone":"m10","scope":"controller","source_path":"macro_sim/controllers/transaction.py","source_symbol":"world_policy_fingerprint","status":"active"},{"cadence":"configured","comparison":"registered_tolerance","id":"invariant.demography.financial-claims","kind":"invariant","owner_milestone":"m7","scope":"economy","source_path":"macro_sim/demographics/economic_bridge.py","source_symbol":"DemographicEconomicBridge.assert_all_claim_identities","status":"active"},{"cadence":"tick","comparison":"exact","id":"invariant.housing.stock-and-title","kind":"invariant","owner_milestone":"m8","scope":"economy","source_path":"macro_sim/housing/registry.py","source_symbol":"HousingRegistry.assert_invariants","status":"active"},{"cadence":"tick","comparison":"registered_tolerance","id":"invariant.labor.stock-flow","kind":"invariant","owner_milestone":"m7","scope":"economy","source_path":"macro_sim/labor/accounting.py","source_symbol":"LaborAccounts.assert_identity","status":"active"},{"cadence":"tick","comparison":"exact_or_registered_residual","id":"invariant.ledger.deposit-conservation","kind":"invariant","owner_milestone":"m2","scope":"economy","source_path":"macro_sim/core/ledger.py","source_symbol":"Ledger.assert_conserved","status":"active"},{"cadence":"tick","comparison":"registered_tolerance","id":"invariant.ledger.nonnegative-balances","kind":"invariant","owner_milestone":"m2","scope":"economy","source_path":"macro_sim/core/ledger.py","source_symbol":"Ledger.assert_non_negative","status":"active"},{"cadence":"tick","comparison":"registered_tolerance","id":"invariant.ledger.reserve-conservation","kind":"invariant","owner_milestone":"m2","scope":"economy","source_path":"macro_sim/core/ledger.py","source_symbol":"Ledger.assert_reserves_conserved","status":"active"},{"cadence":"tick","comparison":"registered_tolerance","id":"invariant.securities.issuer-holder-identities","kind":"invariant","owner_milestone":"m6","scope":"economy","source_path":"macro_sim/systems/securities.py","source_symbol":"assert_securities_identities","status":"active"},{"cadence":"replay","comparison":"exact","id":"invariant.shock.event-hash-chain","kind":"invariant","owner_milestone":"m9","scope":"shock","source_path":"macro_sim/shocks/engine.py","source_symbol":"ShockEventStream.verify","status":"active"},{"cadence":"tick","comparison":"registered_tolerance","id":"invariant.world.current-account-sum","kind":"invariant","owner_milestone":"m9","scope":"world","source_path":"macro_sim/world/world.py","source_symbol":"World._dealer_update","status":"active"},{"cadence":"tick","comparison":"registered_tolerance","id":"invariant.world.dealer-flow-passthrough","kind":"invariant","owner_milestone":"m9","scope":"world","source_path":"macro_sim/world/fx.py","source_symbol":"FXDealer.assert_flow_is_passthrough","status":"active"},{"cadence":"tick","comparison":"registered_tolerance","id":"invariant.world.nfa-revaluation","kind":"invariant","owner_milestone":"m9","scope":"world","source_path":"macro_sim/world/world.py","source_symbol":"World._dealer_update","status":"active"}],"schema_version":"m0-inventory-v1"}
