{"family":"desktop_protocol","generator_version":"m0-inventory-generator-v1","metadata":{"command_count":7,"commands":["advance","get_schema","hello","new_game","resolve_context","snapshot","trigger_shock"],"protocol_version":3},"oracle_commit":"c0adcf1f8ea7f69cad28b92e27c9a4509dfdac23","rows":[{"command":"advance","id":"desktop.command.advance","kind":"desktop_command","owner_milestone":"m11","request_limit_bytes":1048576,"response_envelope":["ok","request_id","protocol_version","snapshot_or_error"],"single_writer":true,"source_path":"macro_sim/desktop/runtime.py","source_symbol":"SimulationRuntime.handle:advance","status":"active","transport":"newline_delimited_json"},{"command":"get_schema","id":"desktop.command.get_schema","kind":"desktop_command","owner_milestone":"m11","request_limit_bytes":1048576,"response_envelope":["ok","request_id","protocol_version","snapshot_or_error"],"single_writer":true,"source_path":"macro_sim/desktop/runtime.py","source_symbol":"SimulationRuntime.handle:get_schema","status":"active","transport":"newline_delimited_json"},{"command":"hello","id":"desktop.command.hello","kind":"desktop_command","owner_milestone":"m11","request_limit_bytes":1048576,"response_envelope":["ok","request_id","protocol_version","snapshot_or_error"],"single_writer":true,"source_path":"macro_sim/desktop/runtime.py","source_symbol":"SimulationRuntime.handle:hello","status":"active","transport":"newline_delimited_json"},{"command":"new_game","id":"desktop.command.new_game","kind":"desktop_command","owner_milestone":"m11","request_limit_bytes":1048576,"response_envelope":["ok","request_id","protocol_version","snapshot_or_error"],"single_writer":true,"source_path":"macro_sim/desktop/runtime.py","source_symbol":"SimulationRuntime.handle:new_game","status":"active","transport":"newline_delimited_json"},{"command":"resolve_context","id":"desktop.command.resolve_context","kind":"desktop_command","owner_milestone":"m11","request_limit_bytes":1048576,"response_envelope":["ok","request_id","protocol_version","snapshot_or_error"],"single_writer":true,"source_path":"macro_sim/desktop/runtime.py","source_symbol":"SimulationRuntime.handle:resolve_context","status":"active","transport":"newline_delimited_json"},{"command":"snapshot","id":"desktop.command.snapshot","kind":"desktop_command","owner_milestone":"m11","request_limit_bytes":1048576,"response_envelope":["ok","request_id","protocol_version","snapshot_or_error"],"single_writer":true,"source_path":"macro_sim/desktop/runtime.py","source_symbol":"SimulationRuntime.handle:snapshot","status":"active","transport":"newline_delimited_json"},{"command":"trigger_shock","id":"desktop.command.trigger_shock","kind":"desktop_command","owner_milestone":"m11","request_limit_bytes":1048576,"response_envelope":["ok","request_id","protocol_version","snapshot_or_error"],"single_writer":true,"source_path":"macro_sim/desktop/runtime.py","source_symbol":"SimulationRuntime.handle:trigger_shock","status":"active","transport":"newline_delimited_json"},{"error_fields":["type","message"],"fields":["ok","request_id","protocol_version","error"],"id":"desktop.response.error","kind":"desktop_response","owner_milestone":"m11","source_path":"macro_sim/desktop/server.py","source_symbol":"_Handler.handle:error","status":"active"},{"fields":["ok","request_id","protocol_version","snapshot"],"id":"desktop.response.success","kind":"desktop_response","owner_milestone":"m11","source_path":"macro_sim/desktop/server.py","source_symbol":"_Handler.handle:success","status":"active"}],"schema_version":"m0-inventory-v1"}
