{"family":"m4_v0_v1","generator_version":"m0-inventory-generator-v1","metadata":{"source_schema_version":"m0-m4-vertical-manifest-v1","vertical_count":2},"oracle_commit":"c0adcf1f8ea7f69cad28b92e27c9a4509dfdac23","rows":[{"benchmark_scenario":"m4_v0_cash_loop","capabilities":{"rejected":["bank_enabled","bonds","capital_market","demographics_enabled","energy_enabled","government","housing_enabled"],"required":[],"supported":["consumption_rationed_signal","labor_matching"]},"description":"Minimal household-firm cash, labor, production, and goods loop.","id":"m4.v0","invariants":["invariant.ledger.deposit-conservation","invariant.ledger.nonnegative-balances"],"kind":"m4_vertical","metrics":["metric.economy.real_output","metric.economy.price_index","metric.economy.unemployment_rate","metric.economy.total_money","metric.economy.conservation_drift"],"name":"cash_loop","owner_milestone":"m4","phases":["phase.economy.open-books","phase.economy.open-real-economy","phase.economy.plan-and-finance","phase.economy.produce-and-trade-domestic","phase.economy.settle-domestic","phase.economy.validate-and-measure","phase.economy.stage-local-commit"],"rng_policy":"disabled_or_materialized","source_path":"schemas/m0/manifests/m4_v0_v1.yaml","source_symbol":"m4.v0","status":"active","stores":["account","household","consumption_firm","employment","goods_inventory"]},{"benchmark_scenario":"m4_v1_capital_fiscal","capabilities":{"rejected":["bank_enabled","bonds","demographics_enabled","energy_enabled","housing_enabled"],"required":["government"],"supported":["capital_market","government"]},"description":"V0 plus capital goods, technology, taxation, and basic spending.","extends":"m4.v0","id":"m4.v1","invariants":["invariant.ledger.deposit-conservation","invariant.ledger.nonnegative-balances"],"kind":"m4_vertical","metrics":["metric.economy.aggregate_capital","metric.economy.gov_spending","metric.economy.tax_total"],"name":"capital_fiscal","owner_milestone":"m4","phases":["phase.economy.open-real-economy","phase.economy.plan-and-finance","phase.economy.produce-and-trade-domestic","phase.economy.settle-domestic","phase.economy.validate-and-measure"],"rng_policy":"disabled_or_materialized","source_path":"schemas/m0/manifests/m4_v0_v1.yaml","source_symbol":"m4.v1","status":"active","stores":["capital_firm","physical_capital","treasury_account"]}],"schema_version":"m0-inventory-v1"}
