{"family":"phases","generator_version":"m0-inventory-generator-v1","metadata":{"explicit_runtime_constants":false,"phase_count":16,"runtime_instrumentation_work_package":"m0-03","source_schema_version":"m0-phase-source-v1"},"oracle_commit":"c0adcf1f8ea7f69cad28b92e27c9a4509dfdac23","rows":[{"id":"phase.boundary.control","kind":"phase","name":"ControlBoundaryLatch","order":0,"owner_milestone":"m10","phase_code":"B0","scope":"session","snapshot_after":"tick_open","snapshot_before":"prior_committed","source_path":"macro_sim/controllers/session.py","source_symbol":"ControlledSimulationSession.advance","status":"active"},{"id":"phase.economy.close-institutions","kind":"phase","name":"CloseInstitutions","order":100,"owner_milestone":"m5","phase_code":"E7","scope":"economy","snapshot_after":"institutions_closed","snapshot_before":"domestic_settled","source_path":"macro_sim/economy.py","source_symbol":"Economy._run_settlement_and_commit_phases","status":"active"},{"id":"phase.economy.open-books","kind":"phase","name":"OpenBooks","order":10,"owner_milestone":"m4","phase_code":"E0","scope":"economy","snapshot_after":"books_open","snapshot_before":"tick_open","source_path":"macro_sim/economy.py","source_symbol":"Economy._run_pre_settlement_phases","status":"active"},{"id":"phase.economy.open-financial-system","kind":"phase","name":"OpenFinancialSystem","order":20,"owner_milestone":"m5","phase_code":"E1","scope":"economy","snapshot_after":"financial_open","snapshot_before":"books_open","source_path":"macro_sim/economy.py","source_symbol":"Economy._run_pre_settlement_phases","status":"active"},{"id":"phase.economy.open-real-economy","kind":"phase","name":"OpenRealEconomy","order":30,"owner_milestone":"m4","phase_code":"E2","scope":"economy","snapshot_after":"real_open","snapshot_before":"financial_open","source_path":"macro_sim/economy.py","source_symbol":"Economy._run_pre_settlement_phases","status":"active"},{"id":"phase.economy.plan-and-finance","kind":"phase","name":"PlanAndFinance","order":50,"owner_milestone":"m4","phase_code":"E4","scope":"economy","snapshot_after":"planned","snapshot_before":"post_population_pre_plan","source_path":"macro_sim/economy.py","source_symbol":"Economy._run_pre_settlement_phases","status":"active"},{"id":"phase.economy.population-boundary","kind":"phase","name":"PopulationBoundary","order":40,"owner_milestone":"m7","phase_code":"E3","scope":"economy","snapshot_after":"post_population_pre_plan","snapshot_before":"real_open","source_path":"macro_sim/economy.py","source_symbol":"Economy._run_pre_settlement_phases","status":"active"},{"id":"phase.economy.produce-and-trade-domestic","kind":"phase","name":"ProduceAndTradeDomestic","order":60,"owner_milestone":"m4","phase_code":"E5","scope":"economy","snapshot_after":"pre_dealer","snapshot_before":"planned","source_path":"macro_sim/economy.py","source_symbol":"Economy._run_pre_settlement_phases","status":"active"},{"id":"phase.economy.settle-domestic","kind":"phase","name":"SettleDomestic","order":90,"owner_milestone":"m4","phase_code":"E6","scope":"economy","snapshot_after":"domestic_settled","snapshot_before":"post_dealer","source_path":"macro_sim/economy.py","source_symbol":"Economy._run_settlement_and_commit_phases","status":"active"},{"id":"phase.economy.stage-local-commit","kind":"phase","name":"StageLocalCommit","order":130,"owner_milestone":"m4","phase_code":"E9","scope":"economy","snapshot_after":"local_staged","snapshot_before":"globally_validated","source_path":"macro_sim/economy.py","source_symbol":"Economy._commit_cross_tick_state","status":"active"},{"id":"phase.economy.validate-and-measure","kind":"phase","name":"ValidateAndMeasure","order":110,"owner_milestone":"m10","phase_code":"E8","scope":"economy","snapshot_after":"provisional_measured","snapshot_before":"institutions_closed","source_path":"macro_sim/economy.py","source_symbol":"Economy._phase5_check_and_record","status":"active"},{"id":"phase.world.commit-boundary","kind":"phase","name":"CommitBoundary","order":140,"owner_milestone":"m9","phase_code":"W.CommitBoundary","scope":"world","snapshot_after":"committed","snapshot_before":"local_staged","source_path":"macro_sim/world/world.py","source_symbol":"World.step","status":"active"},{"id":"phase.world.dealer-settlement","kind":"phase","name":"DealerSettlement","order":80,"owner_milestone":"m9","phase_code":"W.DealerSettlement","scope":"world","snapshot_after":"post_dealer","snapshot_before":"external_reserved","source_path":"macro_sim/world/world.py","source_symbol":"World._dealer_update","status":"active"},{"id":"phase.world.external-settlement-seam","kind":"phase","name":"ExternalSettlementSeam","order":70,"owner_milestone":"m9","phase_code":"W0","scope":"world","snapshot_after":"external_reserved","snapshot_before":"pre_dealer","source_path":"macro_sim/world/world.py","source_symbol":"World._coupling_barrier","status":"active"},{"id":"phase.world.publish","kind":"phase","name":"Publish","order":150,"owner_milestone":"m10","phase_code":"W.Publish","scope":"session","snapshot_after":"published","snapshot_before":"committed","source_path":"macro_sim/controllers/session.py","source_symbol":"ControlledSimulationSession.advance","status":"active"},{"id":"phase.world.validate-global","kind":"phase","name":"ValidateGlobal","order":120,"owner_milestone":"m9","phase_code":"W.ValidateGlobal","scope":"world","snapshot_after":"globally_validated","snapshot_before":"provisional_measured","source_path":"macro_sim/world/world.py","source_symbol":"World._dealer_update","status":"active"}],"schema_version":"m0-inventory-v1"}
