{"family":"events","generator_version":"m0-inventory-generator-v1","metadata":{"controller_event_type_count":20,"dynamic_expansions":{"coordinator_input_event_type":["proposal_submitted","timeout"],"session_shock_bridge":["shock_announced","shock_ended","shock_realized","shock_started"]},"shock_event_type_count":4},"oracle_commit":"c0adcf1f8ea7f69cad28b92e27c9a4509dfdac23","rows":[{"event_type":"decision_accepted","hash_chain":true,"id":"event.controller.decision_accepted","kind":"event","ordering_key":["global_sequence"],"owner_milestone":"m10","replay_classes":["input","derived"],"schema_version":1,"source_path":"macro_sim/controllers/events.py","source_symbol":"EventStream:decision_accepted","status":"active","stream":"controller"},{"event_type":"decision_accepted_noop","hash_chain":true,"id":"event.controller.decision_accepted_noop","kind":"event","ordering_key":["global_sequence"],"owner_milestone":"m10","replay_classes":["input","derived"],"schema_version":1,"source_path":"macro_sim/controllers/events.py","source_symbol":"EventStream:decision_accepted_noop","status":"active","stream":"controller"},{"event_type":"decision_cancelled","hash_chain":true,"id":"event.controller.decision_cancelled","kind":"event","ordering_key":["global_sequence"],"owner_milestone":"m10","replay_classes":["input","derived"],"schema_version":1,"source_path":"macro_sim/controllers/events.py","source_symbol":"EventStream:decision_cancelled","status":"active","stream":"controller"},{"event_type":"decision_context_opened","hash_chain":true,"id":"event.controller.decision_context_opened","kind":"event","ordering_key":["global_sequence"],"owner_milestone":"m10","replay_classes":["input","derived"],"schema_version":1,"source_path":"macro_sim/controllers/events.py","source_symbol":"EventStream:decision_context_opened","status":"active","stream":"controller"},{"event_type":"decision_failed_at_execution","hash_chain":true,"id":"event.controller.decision_failed_at_execution","kind":"event","ordering_key":["global_sequence"],"owner_milestone":"m10","replay_classes":["input","derived"],"schema_version":1,"source_path":"macro_sim/controllers/events.py","source_symbol":"EventStream:decision_failed_at_execution","status":"active","stream":"controller"},{"event_type":"decision_rejected","hash_chain":true,"id":"event.controller.decision_rejected","kind":"event","ordering_key":["global_sequence"],"owner_milestone":"m10","replay_classes":["input","derived"],"schema_version":1,"source_path":"macro_sim/controllers/events.py","source_symbol":"EventStream:decision_rejected","status":"active","stream":"controller"},{"event_type":"decision_superseded","hash_chain":true,"id":"event.controller.decision_superseded","kind":"event","ordering_key":["global_sequence"],"owner_milestone":"m10","replay_classes":["input","derived"],"schema_version":1,"source_path":"macro_sim/controllers/events.py","source_symbol":"EventStream:decision_superseded","status":"active","stream":"controller"},{"event_type":"emergency_trigger","hash_chain":true,"id":"event.controller.emergency_trigger","kind":"event","ordering_key":["global_sequence"],"owner_milestone":"m10","replay_classes":["input","derived"],"schema_version":1,"source_path":"macro_sim/controllers/events.py","source_symbol":"EventStream:emergency_trigger","status":"active","stream":"controller"},{"event_type":"forced_system_transition","hash_chain":true,"id":"event.controller.forced_system_transition","kind":"event","ordering_key":["global_sequence"],"owner_milestone":"m10","replay_classes":["input","derived"],"schema_version":1,"source_path":"macro_sim/controllers/events.py","source_symbol":"EventStream:forced_system_transition","status":"active","stream":"controller"},{"event_type":"human_proposal_collected","hash_chain":true,"id":"event.controller.human_proposal_collected","kind":"event","ordering_key":["global_sequence"],"owner_milestone":"m10","replay_classes":["input","derived"],"schema_version":1,"source_path":"macro_sim/controllers/events.py","source_symbol":"EventStream:human_proposal_collected","status":"active","stream":"controller"},{"event_type":"human_proposal_queued","hash_chain":true,"id":"event.controller.human_proposal_queued","kind":"event","ordering_key":["global_sequence"],"owner_milestone":"m10","replay_classes":["input","derived"],"schema_version":1,"source_path":"macro_sim/controllers/events.py","source_symbol":"EventStream:human_proposal_queued","status":"active","stream":"controller"},{"event_type":"pending_cancel_requested","hash_chain":true,"id":"event.controller.pending_cancel_requested","kind":"event","ordering_key":["global_sequence"],"owner_milestone":"m10","replay_classes":["input","derived"],"schema_version":1,"source_path":"macro_sim/controllers/events.py","source_symbol":"EventStream:pending_cancel_requested","status":"active","stream":"controller"},{"event_type":"policy_transaction_effective","hash_chain":true,"id":"event.controller.policy_transaction_effective","kind":"event","ordering_key":["global_sequence"],"owner_milestone":"m10","replay_classes":["input","derived"],"schema_version":1,"source_path":"macro_sim/controllers/events.py","source_symbol":"EventStream:policy_transaction_effective","status":"active","stream":"controller"},{"event_type":"proposal_submitted","hash_chain":true,"id":"event.controller.proposal_submitted","kind":"event","ordering_key":["global_sequence"],"owner_milestone":"m10","replay_classes":["input","derived"],"schema_version":1,"source_path":"macro_sim/controllers/events.py","source_symbol":"EventStream:proposal_submitted","status":"active","stream":"controller"},{"event_type":"seat_assignment","hash_chain":true,"id":"event.controller.seat_assignment","kind":"event","ordering_key":["global_sequence"],"owner_milestone":"m10","replay_classes":["input","derived"],"schema_version":1,"source_path":"macro_sim/controllers/events.py","source_symbol":"EventStream:seat_assignment","status":"active","stream":"controller"},{"event_type":"shock_announced","hash_chain":true,"id":"event.controller.shock_announced","kind":"event","ordering_key":["global_sequence"],"owner_milestone":"m10","replay_classes":["input","derived"],"schema_version":1,"source_path":"macro_sim/controllers/events.py","source_symbol":"EventStream:shock_announced","status":"active","stream":"controller"},{"event_type":"shock_ended","hash_chain":true,"id":"event.controller.shock_ended","kind":"event","ordering_key":["global_sequence"],"owner_milestone":"m10","replay_classes":["input","derived"],"schema_version":1,"source_path":"macro_sim/controllers/events.py","source_symbol":"EventStream:shock_ended","status":"active","stream":"controller"},{"event_type":"shock_realized","hash_chain":true,"id":"event.controller.shock_realized","kind":"event","ordering_key":["global_sequence"],"owner_milestone":"m10","replay_classes":["input","derived"],"schema_version":1,"source_path":"macro_sim/controllers/events.py","source_symbol":"EventStream:shock_realized","status":"active","stream":"controller"},{"event_type":"shock_started","hash_chain":true,"id":"event.controller.shock_started","kind":"event","ordering_key":["global_sequence"],"owner_milestone":"m10","replay_classes":["input","derived"],"schema_version":1,"source_path":"macro_sim/controllers/events.py","source_symbol":"EventStream:shock_started","status":"active","stream":"controller"},{"event_type":"timeout","hash_chain":true,"id":"event.controller.timeout","kind":"event","ordering_key":["global_sequence"],"owner_milestone":"m10","replay_classes":["input","derived"],"schema_version":1,"source_path":"macro_sim/controllers/events.py","source_symbol":"EventStream:timeout","status":"active","stream":"controller"},{"event_type":"announced","hash_chain":true,"id":"event.shock.announced","kind":"event","ordering_key":["tick","event_sequence"],"owner_milestone":"m9","schema_version":1,"source_path":"macro_sim/shocks/engine.py","source_symbol":"ShockEventStream:announced","status":"active","stream":"shock"},{"event_type":"ended","hash_chain":true,"id":"event.shock.ended","kind":"event","ordering_key":["tick","event_sequence"],"owner_milestone":"m9","schema_version":1,"source_path":"macro_sim/shocks/engine.py","source_symbol":"ShockEventStream:ended","status":"active","stream":"shock"},{"event_type":"realized","hash_chain":true,"id":"event.shock.realized","kind":"event","ordering_key":["tick","event_sequence"],"owner_milestone":"m9","schema_version":1,"source_path":"macro_sim/shocks/engine.py","source_symbol":"ShockEventStream:realized","status":"active","stream":"shock"},{"event_type":"started","hash_chain":true,"id":"event.shock.started","kind":"event","ordering_key":["tick","event_sequence"],"owner_milestone":"m9","schema_version":1,"source_path":"macro_sim/shocks/engine.py","source_symbol":"ShockEventStream:started","status":"active","stream":"shock"}],"schema_version":"m0-inventory-v1"}
