{"family":"shocks","generator_version":"m0-inventory-generator-v1","metadata":{"default_kind_count":8,"schema_version":1},"oracle_commit":"c0adcf1f8ea7f69cad28b92e27c9a4509dfdac23","rows":[{"allowed_sectors":["capital","consumption","energy","housing","luxury","necessity","public"],"channel":"capital_destruction","combination_rule":"multiplicative_factor_or_registered_one_shot","description":"One-shot destruction of private/public physical capital.","emergency_seats":["treasury"],"id":"shock.capital_destruction","kind":"shock","lifecycle_source":"macro_sim/shocks/engine.py::ShockEngine","magnitude_max":0.99,"magnitude_min":0.0,"one_shot":true,"owner_milestone":"m9","replay_source":"macro_sim/shocks/spec.py::ShockTape","required_capability":null,"shock_kind":"capital_destruction","source_path":"macro_sim/shocks/registry.py","source_symbol":"DEFAULT_SHOCK_REGISTRY.capital_destruction","status":"active"},{"allowed_sectors":[],"channel":"credit_supply","combination_rule":"multiplicative_factor_or_registered_one_shot","description":"Bank loan-origination supply disturbance.","emergency_seats":["central_bank","regulator","treasury"],"id":"shock.credit_supply","kind":"shock","lifecycle_source":"macro_sim/shocks/engine.py::ShockEngine","magnitude_max":0.99,"magnitude_min":-3.0,"one_shot":false,"owner_milestone":"m9","replay_source":"macro_sim/shocks/spec.py::ShockTape","required_capability":"bank_enabled","shock_kind":"credit_supply","source_path":"macro_sim/shocks/registry.py","source_symbol":"DEFAULT_SHOCK_REGISTRY.credit_supply","status":"active"},{"allowed_sectors":["energy"],"channel":"energy_capacity","combination_rule":"multiplicative_factor_or_registered_one_shot","description":"Physical energy capacity disturbance.","emergency_seats":["energy","treasury"],"id":"shock.energy_capacity","kind":"shock","lifecycle_source":"macro_sim/shocks/engine.py::ShockEngine","magnitude_max":0.99,"magnitude_min":-3.0,"one_shot":false,"owner_milestone":"m9","replay_source":"macro_sim/shocks/spec.py::ShockTape","required_capability":"energy_enabled","shock_kind":"energy_capacity","source_path":"macro_sim/shocks/registry.py","source_symbol":"DEFAULT_SHOCK_REGISTRY.energy_capacity","status":"active"},{"allowed_sectors":[],"channel":"export_capacity","combination_rule":"multiplicative_factor_or_registered_one_shot","description":"Exporter-side physical shipping capacity.","emergency_seats":["external_affairs","treasury"],"id":"shock.export_capacity","kind":"shock","lifecycle_source":"macro_sim/shocks/engine.py::ShockEngine","magnitude_max":0.99,"magnitude_min":-3.0,"one_shot":false,"owner_milestone":"m9","replay_source":"macro_sim/shocks/spec.py::ShockTape","required_capability":"world_trade","shock_kind":"export_capacity","source_path":"macro_sim/shocks/registry.py","source_symbol":"DEFAULT_SHOCK_REGISTRY.export_capacity","status":"active"},{"allowed_sectors":[],"channel":"household_demand","combination_rule":"multiplicative_factor_or_registered_one_shot","description":"Household desired-spending disturbance.","emergency_seats":["central_bank","treasury"],"id":"shock.household_demand","kind":"shock","lifecycle_source":"macro_sim/shocks/engine.py::ShockEngine","magnitude_max":0.99,"magnitude_min":-3.0,"one_shot":false,"owner_milestone":"m9","replay_source":"macro_sim/shocks/spec.py::ShockTape","required_capability":null,"shock_kind":"household_demand","source_path":"macro_sim/shocks/registry.py","source_symbol":"DEFAULT_SHOCK_REGISTRY.household_demand","status":"active"},{"allowed_sectors":[],"channel":"import_capacity","combination_rule":"multiplicative_factor_or_registered_one_shot","description":"Importer-side physical trade capacity.","emergency_seats":["external_affairs","treasury"],"id":"shock.import_capacity","kind":"shock","lifecycle_source":"macro_sim/shocks/engine.py::ShockEngine","magnitude_max":0.99,"magnitude_min":-3.0,"one_shot":false,"owner_milestone":"m9","replay_source":"macro_sim/shocks/spec.py::ShockTape","required_capability":"world_trade","shock_kind":"import_capacity","source_path":"macro_sim/shocks/registry.py","source_symbol":"DEFAULT_SHOCK_REGISTRY.import_capacity","status":"active"},{"allowed_sectors":["capital","consumption","energy","housing","luxury","necessity"],"channel":"labor_availability","combination_rule":"multiplicative_factor_or_registered_one_shot","description":"Effective attendance/available-labor disturbance.","emergency_seats":["treasury"],"id":"shock.labor_availability","kind":"shock","lifecycle_source":"macro_sim/shocks/engine.py::ShockEngine","magnitude_max":0.99,"magnitude_min":-3.0,"one_shot":false,"owner_milestone":"m9","replay_source":"macro_sim/shocks/spec.py::ShockTape","required_capability":null,"shock_kind":"labor_availability","source_path":"macro_sim/shocks/registry.py","source_symbol":"DEFAULT_SHOCK_REGISTRY.labor_availability","status":"active"},{"allowed_sectors":["capital","consumption","energy","housing","luxury","necessity"],"channel":"productivity","combination_rule":"multiplicative_factor_or_registered_one_shot","description":"Sector output-factor disturbance.","emergency_seats":["central_bank","treasury"],"id":"shock.productivity","kind":"shock","lifecycle_source":"macro_sim/shocks/engine.py::ShockEngine","magnitude_max":0.99,"magnitude_min":-3.0,"one_shot":false,"owner_milestone":"m9","replay_source":"macro_sim/shocks/spec.py::ShockTape","required_capability":null,"shock_kind":"productivity","source_path":"macro_sim/shocks/registry.py","source_symbol":"DEFAULT_SHOCK_REGISTRY.productivity","status":"active"}],"schema_version":"m0-inventory-v1"}
