{"family":"probes","generator_version":"m0-inventory-generator-v1","metadata":{"probe_count":6,"source_schema_version":"m0-probe-disposition-v1","unresolved_count":0},"oracle_commit":"c0adcf1f8ea7f69cad28b92e27c9a4509dfdac23","rows":[{"cadence":"scenario","disposition":"python_oracle_only","id":"probe.diagnostics.runner","kind":"probe","owner_milestone":"m10","snapshot_epoch":"published","source_path":"macro_sim/diagnostics/runner.py","source_symbol":"run_diagnostic_suite","status":"oracle_only"},{"cadence":"diagnostic","disposition":"typed_privileged","id":"probe.economy.deep","kind":"probe","owner_milestone":"m10","snapshot_epoch":"committed","source_path":"macro_sim/diagnostics/probes.py","source_symbol":"DeepProbeCollector","status":"active"},{"cadence":"report","disposition":"derived_from_snapshot","id":"probe.empirical.runner","kind":"probe","owner_milestone":"m10","snapshot_epoch":"published","source_path":"macro_sim/diagnostics/empirical.py","source_symbol":"diagnose_empirical_fit","status":"active"},{"cadence":"scenario","disposition":"python_oracle_only","id":"probe.open-economy.portrait","kind":"probe","owner_milestone":"m10","snapshot_epoch":"published","source_path":"scripts/openecon_portrait.py","source_symbol":"main","status":"oracle_only"},{"cadence":"report","disposition":"derived_from_snapshot","id":"probe.reporting.dashboard","kind":"probe","owner_milestone":"m10","snapshot_epoch":"published","source_path":"macro_sim/reporting/diagnostics.py","source_symbol":"plot_dashboard","status":"active"},{"cadence":"diagnostic","disposition":"typed_privileged","id":"probe.world.deep","kind":"probe","owner_milestone":"m10","snapshot_epoch":"committed","source_path":"macro_sim/diagnostics/world_probes.py","source_symbol":"WorldProbeCollector","status":"active"}],"schema_version":"m0-inventory-v1"}
